story,arc
I was feeling ill. I scheduled a doctor's appointment. I went to see the doctor. He ran some tests. I found out I had the flu.,sadness - neutral - realization
Christian's school was starting football tryouts. Christian decided to try out for the team. He practiced every day. He tried out for the team. Christian got on the team.,neutral - approval - admiration - neutral
Tim and Gina both hated doing the dishes. They would each alternate which week to do them. Last week Gina wasn't able to get to hers. She had been working longer hours than usual. Tim did the dishes for Gina to be kind.,neutral
"Jen brought her cat Lee to the vet for a checkup. The veterinarian, Doctor Mike, found three fleas on Lee. Doctor Mike suggested a flea dip to Jen. Jen refused because she did not want Lee to be dipped in chemicals. Jen noticed that Lee's flea problem quickly got worse.",neutral - disapproval - realization
"Mish got the text telling her she could leave now. Quickly, she ran to her car, keys in hand. She knew she had limited time, so she drove fast. When she got to the train station, she checked her watch. She had just enough time to make the train.",neutral
Gina was searching for her phone in her dad's car. She was sure it would be there. But after checking everywhere she couldn't see it. She ran in the house and grabbed a flashlight. Gina found her phone.,neutral
"Sarah had an appointment to interview for a job. She put on her best skirt suit and headed to the interview. As she sat at the interview, Sarah noticed a run in her stockings. She was so focused on the flaw, she merely mumbled her replies. Because of her replies, Sarah didn't get the job.",neutral - disappointment
"Linda and her boyfriend were hungry. She wanted to eat tacos. He wanted to eat fish. They both felt powerful, and couldn't decide what to eat between them. Linda and her boyfriend ended up getting both.",neutral - sadness
"Morris buys himself a skateboard to stay active. He brings the skateboard to the park for a day of skateboarding. He notices that he is much older than the other people there. However, they welcome him, and they don't seem to mind his age. The younger skaters taught Morris a lot of tricks.",neutral - realization - neutral
Ron liked to drink a lot of beer. His dad and his mom were both alcoholics. Ron decided it was best if he didn't drink anymore. He finally quit after 6 months. Ron was proud of the decision he made.,neutral - pride
"Jane wanted long hair. So she let it grow for months and months. But it became difficult to take care of. And when it was summer, hair long hair made her too hot. Jane decided to cut her hair short for summer.",neutral - caring - neutral
Alex awoke to bright sunlight. She looked at her clock alarm. She realized she must have overslept! Alex jumped out of bed. She was late for school.,neutral - realization - neutral
I was eating lunch with friends at a new place. I asked for a Coke. They told me they only had Pepsi products. They asked me if I was fine with that. I said i was fine with that.,approval - neutral - approval
We woke up this morning to light snow falling. We're excited that school is cancelled for the day. Everyone went outside to play in the snow. We built a snowman and used a carrot for the nose. We found rocks to use for his eyes and mouth.,approval - excitement - neutral
A squirrel had been visiting Joe's backyard. It would get a few feet from Joe then scurry away. Joe was trying to get it to take a peanut from his hand. One day the squirrel finally did. Joe was happy.,neutral - joy
Arnold bought a new television. He paid cash. After a couple of weeks it stopped working. He tried to return it but had lost his receipt. Arnold was not allowed to return the television.,neutral - realization - disappointment - neutral
"Eric was barely a day over 21. But he already had a drinking problem. Eric woke up and yelped the nearest bar. He hopped in his car half asleep and headed to the place. Pretty soon, he was drunk and passed out at the bar.",neutral - realization
Ellie was at dancing as hard as she could at a new club. All of a sudden she realized she felt an unusual breeze. The seam of her pants in the back had ripped all the way open. She quickly backed off the dance floor. Ellie had to find a new pair of pants quick.,neutral - realization - neutral
I found my shoes uncomfortably stiff. I went out and bought some new shoes. I tried to break them in over time. They still felt too stiff for me. The shoes gave me blisters.,embarrassment - approval - realization - neutral
Marcus was just starting his first flying lesson. He was learning to fly small commuter planes. He was nervous to take the plane up in the air. His instructor helped him take off from the airport. Marcus relaxed once they were in the air.,neutral - nervousness - neutral - relief
"Larry has decided to help out his friends prepare for a party. He needs to bring a salad to the party. Larry slices tomato, lettuce, and other vegetables for the salad. When it is finished, he feels great. Larry was happy that he could contribute to the party.",neutral - excitement - joy
Sarah had never been on a boat before. Today her mom took her to the pier for her very first boat ride. Sarah was very excited. She stepped on the boat and heard the engine roar. She loved every minute of it.,neutral - excitement - neutral - love
Neil wanted to see a historical spot on his trip to London. He took a bus tour to an old prison. It was called the Tower of London. Neil learned the history of the impressive tower. He was fascinated.,neutral - admiration - neutral
"I bought a backup drive for my wife's iPhone. She was running out of space on her phone. She has 1200 photos on her phone. I tried to back up her photos to a drive, but failed. There were too many photos to upload.",neutral - disappointment - neutral
Doug's wife was upset with him. As a way to ask forgiveness he decided to buy her a new car battery. He changed it out and made sure her car was working properly. She appreciated the gesture. Doug's wife kissed him.,disappointment - neutral - admiration - love
"Grace always loved playing tricks on the teacher. Her favorite trick was to hide all of the chalk from the teacher. One day as she was hiding the chalk, the teacher caught Grace. She was suspended from school for two weeks. Grace decided to stop playing tricks at school.",love - neutral
"Jane's mother made a very good apple pie. Jane always wanted the recipe but her mother wouldn't give it to her. One Christmas, she asked her again for the recipe. Jane's mother decided that she would give her the recipe. Jane was thankful to have the recipe.",neutral - gratitude
"Mark opened the back door of the restaurant and walked outside. It was the time of the day to take out the trash. Halfway to the dumpster, he saw many birds, feeding on the trash. He had gone hungry before so he knew all things must eat. He felt bad for the birds.",neutral - sadness
Last night we wanted to order a pizza. Half of us wanted pepperoni. The other half wanted sausage. I made a decision. We ordered a pizza with separate toppings on each half.,desire - neutral - approval - excitement
Simon noticed a moving truck in front of the house next door. The family moving in had a teenage daughter and Simon was smitten. He worked up the courage to go over and introduce himself. She was shy but friendly and receptive enough to encourage him. He hung out with her all day.,neutral - admiration - neutral
"Johnny was on his local Little League team. One Saturday, his team had a very important game. His parents were able to attend. Johnny's team won the game. Johnny was elated.",neutral - excitement - neutral - admiration - grief
Ben was late for class. His teacher yelled at him. He came in late the next day. His teacher wrote a note to his parents. Ben's mother will now wake him  up  one half  hour earlier .,neutral - approval - neutral
"Ally wished for her boyfriend to pick her out a beautiful ring. She left jewelry store fliers on the counter. Next, she circled rings in magazines. She even mentioned them out loud in phone conversations. Ally couldn't wait to get engaged.",neutral - excitement
I was so excited yesterday that usher released a new song. I immediately purchased it. When I listened to it I was blown away. I immediately put it on my phone. I listened to the song all day.,excitement - approval - surprise - neutral
"A new band wanted for their song to get popular fast. They bribed several radio DJs to play their song all at the same time. When people tuned in the radio, the same song played on all stations. They became a huge success overnight. They were very excited about being well known.",neutral - joy - realization - excitement
Annie was the top gymnast in her class. She received many awards and competed a lot. One day after a competition she remembered overdue homework. Her teacher would not let her turn in the homework. She failed the class.,admiration - neutral - sadness
"Patricia was spell-bound as soon as she looked into a microscope. She couldn't believe there was another world she couldn't see. Immediately she knew she was going to become a biologist. The next 8 Years, she studied science in school and college. Patricia eventually became a biologist.",neutral - surprise - neutral
Lily never really enjoyed sports. Over the summer she watched the women's world cup with her family. She was inspired and decided to join a soccer team. The team had been playing for a while and she was behind. She eventually got better.,amusement - neutral - optimism - neutral - optimism
"Marisse went to the auction to look for some items. At the registration desk, they asked her for her credit card. She took out some cash instead and used that as a deposit. She went on to bid on some storage lockers and won two. Sadly, they were both filled with junk.",neutral - sadness
"One year, Jessica went to summer camp. She had a great time. The following year, she was too old to attend the camp. However, she was old enough to work there. She was excited to get to work at the camp.",neutral - excitement
Gina had gotten her phone back from a teacher. He had kept it 2 days. Her mother was becoming suspicious. Now she would be able to keep it secret that it was ever taken. Gina's mother never found out that her phone was taken away.,neutral - curiosity - neutral - sadness
Meg couldn't find her favorite gold earrings. She was beginning to suspect the new maid had stolen them! Her husband admonished her to search the house more carefully. Meg realized that perhaps they had been vacuumed up by mistake! Meg checked the vacuum and then found them.,neutral - realization - neutral
"Marcy wondered about the kids. She had been in the kitchen and hadn't heard them in awhile. Usually, when the kids were quiet, they were getting into something. Marcy looked in the bedrooms and didn't see them. She found them in the living room reading and was relieved.",neutral - relief
Ori's mom sent him off to the market. She admonished him to remember the brown eggs. But Ori couldn't find them at the market. He had to check three different stores. He finally decided to buy white eggs instead.,neutral
"A week before Christmas, Abby and her family got together. They went to a local nursing home, wearing Santa hats. They went from room to room, singing Christmas carols. Some of the patients sang with them. They all had a very memorable time together.",neutral - joy
"Maggie and her classmates went to a zoo for their field trip. They saw monkeys, gorillas and panda's first. After that, they saw snakes and lizards! They even got to feed some of the baby animals. Maggie loved her trip to the zoo.",neutral - love
Vianna was a full-time college student. She did not have a job and she needed money. She searched online for ways to make money from home. She found a site named amazon turk and started working from there. Vianna now works everyday.,neutral
"Everyone in my family got together for Thanksgiving. It was a long journey for many, but they made it. We all sat together and ate dinner. After dinner, we visited and caught up. We had a great time.",neutral - joy
Lina has two kids. Lina was cleaning their rooms and realized their drawers were stuffed. She began to sort through the clothes. Lina had a big pile of clothes that were too small for her kids. Lina gave the clothes to charity.,neutral - realization - neutral
Anna wanted a banana milkshake. Her local ice cream shop didn't have that flavor. She went home and got out her blender. Then she added her own bananas and ice cream. Anna thought her own milkshake tasted just as delicious.,desire - disapproval - neutral - approval
I got into my car and closed the door. I turned the engine on and started to drive. I was headed in the direction of the gas station. It was lunch time and I was starting to get hungry. I decided to buy chips at the gas station.,neutral - approval
"Tommy recently landed a position on his school's Debate team. They were having a debate tonight. He was pretty nervous. When he got there, the entire school was watching. Tommy ended up doing well regardless of his nerves.",neutral - nervousness - neutral - optimism
"Jill was a high school student. She dreaded having to go to class. One day, she decided to ditch school. Her parents found out the next day. Jill's parents scolded her for skipping class.",neutral - fear - neutral
"Chris went shopping for a new car. While on the lot, he saw plenty of cars but none that he liked. He was about to leave when he spotted it. The shiny red car was right in front of him, begging him to buy it. Chris bought the red car.",neutral - disapproval - neutral
Henry wanted to play a scavenger hunt for his son's birthday party. A list of items to retrieve was created first. He turned to neighbors and nearby businesses for help. After placing items in appropriate places he had to create the hints. The kids loved the scavenger hunt.,neutral - love
Jake had a hard time making friends at his new school. He had low self esteem and felt didn't deserve to have friends. One day he met John who happened to feel the same way. John and Jake soon became best friends. They both became more confident and made more friends too.,sadness - neutral - admiration
"Sean was born into an Irish immigrant family. He was always proud of his Irish heritage. His family kept customs, ate Irish food, and watched Irish sports. Sean saved up money and paid for a big trip to Ireland. He was thrilled when he was finally on his way to Ireland.",approval - pride - neutral - joy
"Todd was not careful with his electrical appliances. He plugged in an old toaster with a frayed cord. When he was out of the room, he smelled a strange sound. The toaster had caught fire! He used a fire extinguisher to save the day.",neutral - realization - neutral - caring
"Beth was making mashed potatoes from scratch. After cooking the potatoes it was time to mash them. Her mother didn't have a food processor, Beth had to mash by hand. It was hard work which took hours. Beth was dedicated to making great mashed potatoes.",neutral - admiration
John and Sue often kissed at school in between classes. They were told not to do it but they did anyway. One day the principal caught the two kissing. They were both suspended for a week. They both learned their lesson and no longer kissed in school.,neutral - realization
Ashley's dog has fleas and is scratching himself. Ashley was very worried that she would get fleas as well. She went to the store and put flea and tick shampoo. Ashley then went home and gave her dog a bath. Ashley killed all the fleas.,neutral - fear - neutral
"I lived in the South End of Boston from 1968 to 1981. It was a run down section of town. I bought many books there, since they cost only ten cents. I revisited the shop in 1991. It was very different.",approval - neutral - approval - neutral
My daughter had been begging for a pet. Her birthday was coming up. I visited the pet store to do some research. The workers helped me make a decision. I bought her a dog.,neutral - excitement - neutral - approval - neutral
Kaylee always wanted a puppy. On her birthday her parents took her to a farm. There were lots of beagle puppies there. Her parents told her she could pick a puppy for her birthday. Kaylee was thrilled!,neutral - joy
"Alice wanted to go to school to become a veterinarian. She worked hard all throughout high school to have good grades. She even volunteered at the local zoo to pad her resume. When the time came, she applied to many different schools. She cried of joy when she received her first acceptance letter.",desire - neutral - approval - joy
My laptop didn't want to work. It stopped turning on for some reason. I tried a few different things to fix it. Finally I got a new charger off the internet. Now it comes on every time.,disappointment - neutral
"My laboratory professor was explaining today's lab. He told us not to pour water followed by an acid. While I was looking at my notes, I barely paid attention. When the experiment began, I poured water before an acid in a tube. My professor was very upset.",neutral - disappointment
Jack liked to take trips on the weekends with his friends. They often liked to go skiing in the mountains. Jack theorized that this weekend would have perfect skiing weather. He told his friends to drive with him up to the resort. They rented a car and had a wonderful time skiing.,joy - neutral - approval - neutral - joy
Brad was sick with a cold! He wanted to go out and play! He was too weak to move. His mother gave him soup and medicine. Brad's mother was very caring.,neutral - sadness - neutral
"Barry had only one thousand dollars left in his bank account. He needed to find a job. He searched for 3 months. Eventually, his money ran out. He had to go to a homeless shelter.",neutral - realization - neutral
Juan wanted to make tacos for his family tonight. He went to the grocery store and bought the ingredients. As he was preparing dinner he realized he forgot the tortillas! He wanted to go back to the store but it was closed. Juan's mother showed him how to make a taco casserole instead.,neutral - realization - neutral
Lena was sick. Lena was sad because she wouldn't see her friends at school. So she took her vitamins. She got better quickly Lena went to school only to find out her friends were sick.,neutral - sadness - neutral
Jim was farting a lot more than usual. His wife became concerned because they smelled unusually terrible. She insisted that he go see a doctor. Jim's doctor told him he is becoming lactose intolerant. Jim's wife was relieved to find the source of the problem.,neutral - disgust - neutral - relief
Tim bought a new lamp today. He went home to set it up. Tim opened the box and followed the instructions. He assembled the lamp within five minutes. Tim was pleased the lamp was so easy to set up.,neutral
"Sandy had taken dance for ten Year's. She was about to graduate and wanted to tryout for dance team. She practiced and practiced. On the day of tryouts, she broke her toe. She could not participate in the tryout with the injury.",neutral - desire - admiration - neutral
"Morgan loved tea. She bought a travel mug to bring tea with her to school. She drank all of her tea on the drive to school. So, when she got to school, she had to fill up with more hot water. Morgan was glad she remembered to bring extra tea bags with her.",love - neutral
"Beth started collecting dolls. She bought dolls online and at flea markets and antique shops. Soon Beth's house was full of dolls. When a friend came to visit, there was no room to chat in the house. They had to move the dolls to sit down.",neutral - disappointment - neutral
"Jim was in a go cart race. He designed his go kart by himself. While he raced, his tires fell off. He didn't know what to do. He wasn't able to finish the race.",neutral
"Bob was warm and tender towards his wife. He wanted to get her a very special gift for Valentine's Day. He asked all the people he knew what he should get her. They all had different opinions, leaving Bob confused. Bob finally went with his instincts and picked the perfect gift.",neutral - joy - neutral - confusion - neutral
"Ida had tickets to a two-day outdoor music festival. She was sad when it began to rainy on day one. But then she saw that other attendees weren't upset. They just danced in the rainy, so I followed suit. Ida was glad she could dance in the rain at the festival.",excitement - sadness - neutral - approval - joy
Jeff was walking home to only see a tornado at a distance. Jeff knew he was in danger so he went to a nearby house. He rang the doorbell and asked if he can stay until tornado dies off. The homeowner let Jeff inside. They huddled in the bathroom as the tornado raged overhead.,neutral
"Anna wanted to bake a cake for her mom's birthday. She tried twice, but both cakes fell flat. Then she found a solution. She went to the bakery and bought a cake. Her mother enjoyed the cake greatly.",joy - disappointment - neutral - joy
"Ron had just found out that his family was moving to a farm. Ron was nervous. He knew nothing about animals. But when he got to the new home, he was surprised. Ron found that he rather enjoyed living on a farm.",neutral - nervousness - neutral - surprise - joy
"Ron has anger problems. During a trip to the store, he got angry at a slow cashier. The cashier was sassy, and egged him on further. Ron grabbed the cashier by the shirt, and pulled him over the counter. Ron was arrested.",neutral
"My friend and I decided to start a band and perform for our families. I was singer and my friend played guitar. We practiced in my garage. Eventually, we got pretty good. We performed a small show for our families the next weekend.",neutral - joy - neutral
A boy Jack had been asking his parents to get a puppy for months. After all the time he asked they finally gave in and said yes. Jack spent about thirty minutes looking online for a puppy. He found one in the area that he lived. Jack then showed the online puppy and pleaded with them to get it.,neutral - approval - neutral
Jon loved the night sky. He would spend many of his nights looking at the stars. His mom saw that he loved the night sky. His mom bought him a telescope. Jon used his telescope often.,love - neutral
Jack went on a trip to the store. He really needed to buy some eggs. He looked everywhere but could not find them! He asked the clerk where they were. The clerk told him to find the eggs.,neutral - disappointment - neutral
Jimmy climbed on to the counter while his Mom was distracted. He nimbly scurried to where the stove burner glowed red. Jimmy screamed when his outreached hand touched the burner. His Mom appeared instantly and whisked him away from it. Jimmy cried.,neutral - fear - neutral
"Billy buried some treasure in his backyard. He drew a map so he wouldn't forget where he'd put it. Years passed and Billy's family moved. Decades later, he went back and used his map to dig it back up. He found many treasures from his childhood.",neutral
"My mom took me grocery shopping. She let me pick out all the food. I picked out a lot of candy and snacks! Then, she went to the register and paid for it all. I ate a lot of candy that day.",neutral - excitement - neutral - joy
Joe got fired from his job. He was sad. He needed money for bills. He called  up grant. Grant loaned Joe some money.,neutral - sadness - neutral
Rakesh decides that he would like to cook lobster for dinner. He visits the local seafood market and picks a huge lobster. Rakesh brings it home and boils it in water. He eats the lobster with butter and corn on the cob. Rakesh loved eating lobster.,neutral - love
Ron woke up and looked out the window. The street was covered in a foot of snow! School was canceled that day. Ron spent the whole day playing in the snow with his friends. Ron was very happy.,neutral - joy
My brother loved candy. He ate a lot of it. He left the wrappers on the counter. Our mother scolded him for it. He didn't listen until we got a lot of ants one spring.,love - neutral - realization
Brad wanted eggs for breakfast. Brad was all out of eggs! Brad cried for a long time. Brad's mother came home with eggs! Brad had delicious Eggs Benedict.,neutral - admiration
"Paulo had always wanted to serve in his student council. However, he was worried he wouldn't be elected. Paulo asked many students for their support in the election. Finally on election day, Paulo was elected to student council. Paulo felt proud of his accomplishment.",desire - fear - neutral - approval - pride
"Patrick's parents raised ducks. One day, Patrick was playing near the ducks. One of the ducks started chasing him! The duck caught up to Patrick and bit him on the leg. It didn't break the skin, but Patrick was scared and cried!",neutral - amusement - neutral - fear
I am a different person than I used to be. I used to be heavyset but I lost weight. I took up swimming and lost the weight. I worked out three times week and ate healthy every day. I am much healthier now.,realization - neutral - approval - neutral - joy
Jane's girlfriend works at a flower shop. She never gets tired of her work. One day Jane decided to get her a rose. Even though her girlfriend saw many a day she loved it. Jane's girlfriend was a die-hard flower lover.,neutral - love
"Damon lost his wallet with his ID in it. He searched all over the house. He couldn't find it anywhere. He eventually just went and got a replacement ID. The next day, Damon found his wallet under the bed.",neutral
Bob was going to take his daughter to see Grandma. The two drove to Grandma's house a few miles down the street. Grandma welcomed them with open arms. The 3 of them had a big dinner at night. Bob's daughter thanked Grandma for the delicious meal.,neutral - gratitude
