story,arc
Mary wanted to go to a late movie. Unfortunately she had school and strict parents. She waited until everyone fell asleep and sneaked out. She saw the movie with friends and had a great time. When her parents caught her she was grounded.,desire - sadness - neutral - admiration - neutral
Ivy had been asked on an unconventional date. Her crush Peter had asked her to go hiking! Ivy agreed. They went to the woods and hiked for hours. Afterwards they watched the sunset from a cliff.,neutral - approval - admiration - neutral
A man went to design the tallest tower in the world. He drew plans to make it twice as high as the current tallest. He took the plans to a developer to build. The developer asked him how tall to build the tower. The man built the tower and it was grand.,admiration - neutral - admiration
Lauren and her sisters are visiting Jacksonville Florida this week. On the last day of their trip they want a picture together. Lauren and her sisters pose in front of a cute cafe. She has the picture developed and sends each sister a copy. She gawked at how much her and her sister look alike.,neutral - surprise
"Liz was babysitting a 5 year old boy. He wanted to play hide and seek. She found him a few times but then he disappeared. She was getting frantic as she searched the house for him. When she heard him giggling from a closet, Liz was relieved.",neutral - fear - relief
Mark was running late to work. He tried to get their on time by driving over the speed limit. A traffic cop pulled him over. He was given a speeding ticket. Mark ended up being late for work.,neutral
Amy always wanted to play the flute. The first day of band she told the teacher so. She practiced on her flute everyday for a week. It was terribly hard to play the flute. Amy was very committed.,desire - excitement - neutral - disapproval - neutral
"Emily took her child to the zoo. The saw many animals, including lions. Her child was very afraid of the lions. He started to scream and cry. Emily picked up her child to comfort him.",neutral - fear - sadness - neutral
Kim could have a puppy if she scored a basket in the game. She practiced all day at home. She practiced in the gym after school with her team. Finally it was the day of the big game. Kim scored a basket and got a puppy.,neutral - admiration - neutral - excitement - neutral
"Kayla hadn't been to a social event in nearly three Year's. She was suffering from crippling anxiety. The longer she went without interacting, the more difficult it became. Her brother was nervous for her and took her to a therapist. Kayla told the therapist she was suicidal and asked for help.",neutral - fear - annoyance - neutral
Ricky fell while hiking in the woods. He was terrified! He thought he had fallen into a patch of poison ivy. Then he used his nature guide to identify the plant. He was relieved to find out he was wrong.,fear - neutral
"My husband loves Blue Belle ice cream. Not too long ago, Blue Belle had a recall and quit producing. My son works at Kroger, they recently had a meeting about Blue Belle. Blue Belle ice cream arrived at Kroger last week. My husband is so grateful!",love - realization - neutral - gratitude
Ralph hates shopping. His mom makes him go. They are there for a long time. Ralph helps his mom load and unload the groceries. He is surprised when his mom gives him money for helping.,neutral - surprise
Kayla borrowed a book from her sister. She brought the book with her to a coffee shop to read. Kayla accidentally spilled some of her vanilla latte on the book. She immediately went home to inform her sister. Her sister was mad!,neutral
Laura told a story of burning bras in the 60's. The crowd went wild after learning this personal information. Laura assured the crowd that was long ago. She put her bid in for President. Laura then became elected by the country.,neutral - excitement - neutral - approval
Charlie wanted to be a police officer in Hawaii. He passed his tests and was hired in Honolulu. Charlie liked interacting with the community. Charlie didn't like the amount of corruption in the force. Charlie vowed to change things if he was ever made chief.,desire - approval - love - disapproval - neutral
"Sean's roommates notice that his clothes and bed start to smell. They tell him he needs to clean his laundry pretty soon. Sean protests at first, but finally he cleans his laundry. His roommates are grateful that Sean no longer smells as bad. They tell him to never wait so long to do laundry again.",neutral - gratitude - neutral
"My friend wants to be a doctor, so she took the MCAT. The first time she took it, she did not get a good enough score. She studied very hard and took it again. This time, she did very well! We took her out to drinks to celebrate.",neutral - disapproval - admiration - optimism - joy
"Kelly went down to the ocean to relax. She immediately went and put her feet in. As she put her feet in however, the wave captured her. Her clothes got soaked. Kelly went home to change into dry clothes.",relief - neutral
"Ben was excited to go fishing with his grandfather for the first time. However, he found putting the worms on the hook to be disgusting. He accidentally pricked his finger with one of the hooks, too. Ben soon realized that fishing was not for him. Ben asked his grandfather if they could watch a movie instead.",excitement - disgust - disappointment - realization - neutral
Amelia was getting ready for a date at a nice Italian restaurant. Amelia's friend had set her up on a blind date a week prior. She got to the restaurant early and waited for her date. Thirty minutes had passed and her date did not show up. Amelia went back home.,neutral
The mom really wanted to get the boy's picture with Santa. The boy was scared and refused. The mom told the boy that Santa was responsible for bringing presents. This changed the boy's mind. The boy hoped to get lots of presents from Santa!,neutral - disapproval - neutral - excitement
"Stewart tried to finish his favorite task before going to bed. He got so engrossed in it, he forgot to keep the fire going. Shivering, he pulled a bunch of blankets around himself. He became very warm and content. When he woke up it was freezing.",neutral - realization - fear - joy - neutral
"Anthony wanted to learn how to speak Spanish. He found an online Spanish course, and he enrolled. Anthony studied hard, and eventually he learned the language. Anthony speaks Spanish fluently now. Anthony became successful because of his linguistic abilities.",neutral - approval - neutral
Amy went to the grocery store after work. She had a short list of items to buy. The store was out of half the items. Amy had to go to a second grocery store. After that she was able to go home and cook a good meal.,neutral
"Joanie got ready to blow dry her hair for a date. She was upset to find her blow dryer missing. Then, Joanie heard a familiar sound coming from outside. She saw her brother using the blow dryer. Joanie ran outside to confront her brother.",neutral - disappointment - realization - neutral - sadness
"Cornelia decides that she wants to rearrange her apartment. Her bed has stood next to the wall for many Year's. Cornelia moves her bed to sit next to the window. When her friends sees her new arrangement, they love it. Soon all her friends had arranged their beds the same way.",neutral - love - neutral
Tim loved his motorcycle. He rode it whenever he could. Up until last week when he wrecked. Now he almost never rides it. Tim is scared to ride his motorcycle.,love - neutral - fear
"Wendy landed her first job as a nurse at a nursing home. She really loved her job and connected with the residents. She really enjoyed talking to a little old lady in particular. One day, the lady showed her pictures of her children. Wendy enjoyed seeing the photos.",neutral - love - joy - neutral - joy
"Lester was proud that he had spent Years without a cell phone. He liked to think he was less dependent on technology than others. However, one day his car had a flat tire and he wished he had a phone. He did not want to have an experience like that again. Lester went out and got the best cell phone he could afford.",pride - neutral - surprise - neutral
Ben needed an oil change in his car. He knew they were quite expensive. Then he saw a coupon in the paper. Ben cut it out and took it to the garage. Ben was able to get his oil changed.,neutral
I woke up hungry. I poured a bowl of cereal but found I did not have any milk. After contemplating using water I decided to go to the store. I walked to the corner and got a half gallon of 2%. I came home and ate cereal.,realization - disappointment - approval - neutral
"Anna had a saltwater fish tank. She only kept coral in it. Then she decided she wanted some fish, too. She bought a few small clownfish and triggers. Now Anna has a diverse tank with fish and coral.",neutral
"Holly was a beautiful black cat that Lee loved very much. Saddly, Holy got very sick and Lee had to put her to sleep. Lee was very sad missing Holly everyday. One day soon after a little black kitten showed up at Lee's back door. Lee decided to adopt the kitten.",admiration - sadness - neutral - love
Bob needed a new pair of socks. He went to the local department store to buy them. The store was having a big sale. He found himself buying lots of great stuff. Bob really enjoyed his shopping trip.,neutral - admiration - joy
Young Reggie loved playing and watching american football. His favorite player was running back Jamal Lewis. He was at the Salt Lake Airport with his family and saw his hero. He went up to him saying that he will also play professional football. Jamal Lewis gave him personal advice and wished him the best.,love - neutral
Ella found a tiny robin on the ground. She knew it must have fallen from its nest. She wrapped it carefully and made it a safe home. Then she fed it worms by hand. She liked taking care of the robin.,neutral - realization - neutral - caring
I made a resolution to quit my job. I wrote my letter of resignation. I quietly went to the office and turned it in. I quit my job. I'm now free to pursue a career that will make me happy.,approval - neutral - approval - joy
"I put the black plastic rose in a vase with water. I left it atop my bookcase for a few weeks. Ten people asked me about it. They wanted to know why I had a watered, fake flower. Honestly, I didn't really know why either.",neutral - confusion
"Ben decided to treat himself to a coffee. He paid for the coffee using his debit card. Later, the bank called him saying he over-drafted. They explained that he had to pay a thirty dollar charge. Ben was frustrated at the extra charge.",neutral - anger
"Chris was on his second layover of the week. Pacing around the airport, he decided he would make use of this time. Installing an app on his phone, he began practicing his french. Another patron of the airport overheard him and offered him assistance The patron helped teach Chris how to speak basic French.",neutral - realization - neutral
"When I was a kid, Google started for the first time. I remember asking my dad how to use the site. He showed me how to type and search anything I wanted. I became enthralled, and spent every day at my desk having fun. I learned a lot from Google.",realization - neutral - joy - admiration
"Jeff was up for a promotion in which he would have to interview for. He went home and studied real hard, memorizing his answers. He prepped for many days until he felt prepared for the interview. He went in for his interview and passed with flying colors! He was pleased when he was given the promotion.",neutral - admiration - excitement - neutral
Fred's boss called him into the office at the propane filling station. He told Fred that times were tough and he had to be laid off. Fred became very angry about this. He picked up his boss by the collar and threw him down. Fred's coworker who saw him assault his boss called the police.,neutral - anger - neutral
My sister in law is trying to save money. She is a recent widow living on a pension. She recently returned two of three cable boxes. I told her that antennas work well now that broadcasts are HD. She was glad to hear that.,neutral - approval - joy
"Victor has always prided himself on trying new foods. However, he has never eaten a pistachio. One day he buys a jar of pistachios to eat at home. He loves how they taste. Victor decides to start buying pistachios regularly.",neutral - love - approval
It was a gorgeous day outside. Emily wanted to take advantage of the great weather. She decided to go to the park. Emily was disappointed when she found out her car wouldn't start. She asked her neighbor for a jump-start.,joy - neutral - disappointment - neutral
"Tom was tired of everyday life. So, he decided to move off the grid. His first week was ok, but soon he ran out of water. He suffered for two days and still couldn't find any. Eventually Tom went back on the grid.",neutral - approval - neutral - sadness - neutral
Tim wanted to learn astronomy. He wanted to go into outer space. However he was to young to be an astronaut. This news made him sad. Tim worked hard in school to become one.,neutral - sadness - admiration
Fred decided to buy some shares of Apple. The stock price was 90 dollars when he bought it. Luckily they had great earnings yesterday. The stock then went up to 100 dollars. Fred was very happy.,approval - neutral - joy - approval - joy
"Jen was so confident in her preparations for the county spelling bee. She had spent the past month studying the dictionary every night. When the Bee started, Jen survived as others got knocked out. It all came down to the final two and Jen's opponent had messed up. Jen won the spelling bee!",optimism - neutral - disappointment - excitement
Kelly hasn't left her apartment in years. I went up to her place today to say hello. I could tell she was reluctant to let me in. We talked for a while about how she's doing. Kelly is agoraphobic.,neutral
Emily was at the beach. The weather started out tranquil. Suddenly the wind began to pick up severely. Anna was caught in a scary sandstorm! She was fortunately able to get back to the beach house safely.,neutral - fear - relief
Andrew had never been in trouble for anything. His parents were out of town for the week. Andrew's friends came over and wanted to drink. So Andrew took out his parents secret stash of alcohol. They drank the alcohol and got drunk.,neutral - approval
Ellen used to live in the country. She misses having days with the power out. One day an ice storm caused the power to go out in her city home. She got very cold. She was happy when the power came back on.,approval - neutral - joy
"Mike was sitting at his desk. But suddenly, he felt a strange itching sensation on his arm. He felt his legs become itchy too. And then his face. Mike had a stroke.",neutral - realization - neutral - sadness
The principal announced there would be a school dance that Friday. Mary became excited about the dance. She wanted Dan to ask her to the school dance. Dan saw Mary in the hallway and told her he needed to talk to her. She was happy he asked her to the dance.,neutral - excitement - neutral - joy
"A new Organic Avenue store opened up in NYC and I checked it out. I was super excited to try it because I never went before. As I walked in, they had amazing salads and juices to try. I tried a summer salad and coconut water. This was my new favorite restaurant.",approval - excitement - admiration - neutral - love
I joined a fantasy football league for the first time this year. I joined my buddy's group because they needed one more person. I've never played before in my life. I ended up winning first place! I was very excited.,approval - neutral - joy - excitement
"Helen got up for work early. It snowed the night before so she had to shovel her car out. It took her an hour to clear the snow. Heading back in the house to get ready, she heard a familiar sound. She had left the shower running.",approval - neutral - approval - neutral
After the state basketball championship reporters interviewed the team. Dan asked if this was live or recorded. The journalist informed him it was a live show. Dan said to the camera his father was his inspiration. Dan admired his father.,neutral - admiration
"Jeremy has a distinct and strong personality. He had a bad time with his job and got fired. He spoke some unflattering things to his manager and co-workers. Since then, he's found it difficult to find a job. Jeremy has a difficult manner for the workplace.",admiration - sadness - disgust - neutral
Fran bought a house on the beach. Everyday the cranes would feed off of the bugs in her yard. One day though the cranes stopped coming around. Several months went by and still no cranes Fran's yard is now overrun with bugs.,approval - neutral - realization
"Our team had a football game today. We were all pumped to win. We got on the field and practiced before the game. Our team was unified, and worked together. Our team felt gratified.",neutral - excitement - approval - neutral - disappointment
Kelly hated math class and struggled to learn the concepts. She struggled a lot with the work and often sought help from teachers. She worked very hard and it paid off with good grades. She was entering college in the fall. Kelly graduated with good grades.,anger - sadness - admiration - neutral - admiration
Sophie's nana was terminally ill. Sophie visited her in the hospital to say goodbye. Her nana gave Sophie her prized gold locket. She told Sophie to keep it to remember her by. Sophie cried.,grief - neutral - sadness
"Kelly had a new job interview today. She got ready in ten minutes and raced out the door. When she got there and met with the woman, she answered questions. When the interview was done, they told her they would call her back. Kelly hoped that she would get a call soon.",excitement - neutral - optimism
"Zack and his friends passed a scary house on their walks to school. One day, they decided to go inside it. Zack and his friends went inside every room. The house was old and abandoned. They left and went to school.",fear - neutral
"Mia went to the casino last night. She began the night by playing some poker. After losing a considerable amount of money, she played slots. She was nearly out of money when the herd RING RING RING. Mia won a jackpot!",neutral - excitement
"Portia loves walking through the woods nearby her house. However, she notices that her sneakers are becoming muddy and gross. She decides to buy a pair of hiking boots. Portia finds a pair that is comfortable and not too expensive. She is happy with her selection.",love - realization - neutral - approval - neutral
Andrew was getting married tomorrow. He had bought the wedding ring months before and couldn't find it! He looked everywhere in his house. Finally he remembered that it was back at the store to get resized. Andrew was so relieved.,neutral - realization - relief
Terry found 2 hundred dollars at work. He took the money home but he wondered if he did the right thing. The next day he took the money to work and turned it in. After a week no one claimed the money so his boss gave it back to him. He learned that honesty pays.,neutral - realization
I love taking long warm showers. They feel great and they're fun. Unfortunately they're wasteful. So I always feel bad when I take one. I decided to only take one long warm shower per week.,love - amusement - disapproval - sadness - approval
"Barry loves playing baseball. Barry decided that he would go and watch a professional game. Barry went to the stadium, and purchased a ticket. Upon entering, Barry decided to grab a beer to drink. Barry also bought a hot dog.",love - neutral
We had fruit flies in our home last year. We looked up various treatments. We tried red wine in bowls. When that didn't work we bought a special trap. We could even see the trap working.,neutral - disappointment - neutral
"Heather and Marcus were ready for the next step in their relationship. They were happy newlyweds, but wanted an addition to their family. Although not quite ready for kids, they still felt lonely. On a whim, they went to an animal shelter and fell in love with a cat. They adopted the cat.",neutral - sadness - neutral
Lots of people were walking to class. They all wanted to get there fast. People started pushing others out of the way. They fell down. The crowd made many people late to class.,approval - neutral
Last Saturday I went to an Azalea concert. The concert was amazing. I got to be in the front row. After the show I went backstage to meet her. Azalea was very cool.,neutral - admiration - approval - neutral - admiration
Eric has always been overweight. His new year's resolution was to stick to a diet. He went to the gym in January and ate healthier. That last about a month. Eric then gave up working out.,neutral - pride - neutral
"Sally was struggling to do well in school. Her parents decided they needed to motivate her. They said if she did well her last semester, she picks the vacation. Sally studied night and day, she wanted to do well. Sally did well, and her parents agreed to take her to Hawaii.",caring - neutral - optimism
"When I was a kid, my siblings and I needed money. We came up with the idea for a lemonade stand. We decided to set up outside our house. We sold lemonade to a few dozen people. We made a lot of money for our needs.",realization - neutral - approval - neutral
"I loved flashlights as a kid. When I got older I bought small clip on flashlights. I put them on my bag to use in case of emergencies. Later, the advent of the smartphone made flashlights less needed. My house is now full of flashlights I don't know what to do with.",love - realization - neutral - realization - confusion
Terry hated his name. He wanted a cool name like Super Metro Volcano Man. He told his mother he wanted to change his name. His mother explained that he was named after his loving grandfather. Terry was still disappointed.,neutral - love - disappointment
The Parker family was looking for a new house. They looked all over town but couldn't find a home they wanted. Finally they found a beautiful home they loved. The home was absolutely gorgeous. The Parker family soon moved into their new home.,neutral - disappointment - love - admiration - neutral
"Tom decided to drive to his girlfriend's house today. He drove as fast as he can although there was a lot of traffic. When he got into the front of the house, he rang the doorbell. No one answered however, the front door was open. Tom began to worry.",neutral - nervousness
Kelly's car battery died. She tried to have it jumped but it didn't work. Eventually she took it to the auto store. They checked it for her and it was dead. Kelly reluctantly paid for a new battery.,neutral - disappointment - neutral - sadness
"Joe bought a skateboard with his savings. He took his new skateboard to the park to show it off to his friends. While doing a trick, Joe fell and broke his arm. He spent four hours at the hospital getting his arm set. Joe was in terrible pain.",neutral - sadness
"Neil had enjoyed Chinese food in Hunan. But he was told the spicier food was in Szechuan province. Intrigued, he took a train there. Then he ordered a plate of rice and noodles. He felt like his mouth was on fire.",joy - neutral - surprise - neutral
"I spent most of my detention time sleeping class. My teacher told me to wake up since no sleeping was aloud. I tried to remain awake and work on a few assignments. When my teacher escorted me out of the class, I was happy. When I got home I went right to bed.",disappointment - neutral - approval - joy - neutral
Amanda was watching a squirrel collect acorns. Amanda was fascinated with how efficient the squirrel was. Amanda watched the squirrel as he carried the acorns to his nest. Amanda also saw how the squirrel was very watchful over the acorns. Amanda enjoys learning about nature.,neutral - approval - neutral - joy
Terry loves to swim but he never learned how to dive. He always jumps in the water feet first. This summer Terry decides he wants to learn how to dive in the water. He practices diving very hard every day. Terry hope to improve.,neutral - optimism
"Kaylee went to work at Cedar Point, the amusement park. While working at Cedar Point, she met James. Kaylee and James started to like each other and soon started dating. One year later, James proposed to Kaylee. Kaylee and James were married in the fall.",neutral - love - neutral
Joanie was interviewing for her first job. She was very nervous. She really wanted to get the position at the ice cream shop. She thought the interview went pretty well. The next day she got a call and was offered the job.,neutral - nervousness - desire - neutral
Ana was a hardworking mom. One day she booked herself an afternoon at a spa. She had her whole body massaged. She even had hydrotherapy sessions. She felt magnificently relaxed and contented afterwards.,neutral - relief
"Bob was a worker on Mechanical Turk. He got a fifty dollar bonus. Bob was happy because it was the biggest bonus he had gotten. Bob put on his glasses and realized it was actually five dollars. Bob was still happy, but less excited.",neutral - joy - realization - joy
Mom didn't want to cook dinner tonight. We were all very hungry. She told us to fend for ourselves. We ate cold cereal for dinner tonight. We were all very upset.,neutral - sadness - neutral - disappointment
"The children were inside playing when they heard music. They ran to their mother and begged for change. She handed them a couple of dollars. They took off running outside, catching up to the ice cream truck. The children excitedly bought ice cream cones.",neutral - excitement
