story,arc
"My son participated in a cub scout toy car derby. Father and son teams designed small matchbox cars. Some teams designed fancy cars. We designed a simple car, which actually won the derby. My son was happy that we won.",neutral - admiration - joy
Brian tried out for the hockey team this year. Unfortunately he did not make the team. The coach said that he needed to be faster on skates. Brian spent all winter working on his speed skating. He eventually made the team.,neutral - disappointment - neutral
Harry really wanted to see the new Star Wars movie. He waited in line at the box office on opening day. He was able to buy a ticket for himself. He watched the entire movie. Harry really liked the movie.,neutral - love
Mark was starting a new job the next day. He was nervous about being around so many strangers. He barely slept any the night before due to anxiety. When he entered the building he was greeted warmly by many people. He realized he would fit in perfectly at the new job.,optimism - fear - nervousness - joy - realization
"Ellen had a baby daughter who slept in a crib in her own room. One morning Ellen did not hear her baby fussing, so she went to check. Her daughter was not moving or breathing! Ellen called the police in a terrible panic. Ellen was horribly afraid.",neutral - fear
Pearl collected CDs with ugly cover art. She prized a jazz CD with two dolphins photoshopped together. Her sister stole the CD while angry with her. Pearl's heart sank and she implored her sister to return it. Pearl's sister was seeking revenge.,disgust - neutral - anger - neutral
"Anna went to the beach. The tide drew out, and she saw a tide pool. She went to inspect it, and she was amazed at all the life in it. There were fish, sea urchins, starfish - it was incredible! Anna watched the sea life and thought about the wonder of nature.",neutral - surprise - excitement - neutral
"Brianna complained bitterly when her family went camping. It would ruin her hair and nails and there was no tv. However, she forgot these things when she tasted her first S'MORE. Munching her treat, she gazed at the huge, starry sky in awe. Brianna loved s'mores.",neutral - excitement - love
Shay was hiking in the woods. Then she realized she was lost! She tried not to panic. She retraced her steps until she found her way back to camp. Shay felt overwhelming relief.,neutral - realization - neutral - realization - relief
Simon got food poisoning. He thought back on all the restaurants he's recently visited. He called his friends who ate with him on these occasions. One of his friends informed him he was also sick with food poisoning. They figured out which restaurant it was.,neutral - realization
Arnold was scared of birds. One day he was at a picnic. A bird was flying in the distance. It landed on his food. Arnold screamed in terror!,fear - neutral - fear
Kip was disappointed there wasn't any snow. He whined to his parents that it just wasn't Christmas without it. They told him to go to bed. Kip stomped his way to his room and eventually fell asleep. Kip dreamed of snowflakes.,disappointment - neutral
Benson was bullied at school by another boy. Benson began losing sleep about it. He finally told his teachers at school about it. The teachers approached the bully about the problem. The bully was expelled.,sadness - neutral
"Karen had gone away for school, leaving behind her partner Sam. Sam was missing Karen, but he had a plan to fix that. On a long weekend, Sam took the train upstate to go visit Karen. Karen who was missing Sam, had a plan to fix it as well. She traveled home to see Sam, and they missed each other!",neutral - sadness
Joey was camping with his friends. He wanted to start a fire to roast marshmallows. He found some sticks and logs in the woods. He used a match to light the logs. Then he roasted marshmallows.,neutral
Diana cleans offices buildings for a living. She washes toilets and scrubs floors. On Friday she was really sick and nauseous at work. She couldn't take the day off. She threw up in the toilet.,neutral - disgust
"Jason's best friend is getting married in India next year. Jason decides that he wants to learn Hindi before the wedding. He hires a tutor and practices speaking Hindi every day. When the wedding day arrives, Jason is fluent in Hindi! Everyone was impressed that Jason had become bilingual.",neutral - admiration
Todd and Ashley were dating. Todd got irritated with Ashley. He gave her the silent treatment. Ashley got upset. She decided not to speak to Todd either.,neutral - disappointment - neutral
"My friends and I got invited to a party at college. We got all dressed up for the exciting event. We were all so excited to have fun! At the party, we danced the whole time. We had a great time!",joy - excitement - joy
Kelly and her friends decided to have a baking party. The girls decided to bake some cookies. They baked chocolate and oatmeal cookies. After they were done they wrapped them in bags. They handed them around to all the neighbors.,neutral
It was a very cold day. The snow was coming down very hard for many hours. The people of Lansing were stuck in their homes without power. The storm brought three feet of snow to the city. School was cancelled.,neutral - disappointment - neutral
Larry was playing golf with his father. Larry was feeling really energetic from his coffee earlier. He hit the ball as hard as he could on his first swing. Larry got a hole in one! Larry was excited  to have scored his first hole in one.,neutral - joy - neutral - excitement
"Candy woke up excited because it was her birthday. But the whole day went by and no one gave her any gifts. She began to feel depressed and thought everyone had forgotten. Later, she got hungry and headed for the kitchen, but stopped. She didn't want to binge eat out of depression.",excitement - neutral - sadness - realization - neutral
"Recently, I became very unhappy with my job. I decided to look around for a new one so I would be happy. I applied to many different places. One place called me back and I went for an interview. I went to the interview and was happy to get the job.",disappointment - joy - approval - neutral - joy
"Lindsey really wanted a new pair of shoes. The shoes were very expensive. She decided to save up her money. After several weeks, she could get the shoes. She bought and enjoyed the shoes.",neutral - joy
Ora had been dared not to shower in order to join a sorority. She couldn't imagine going without clean water for a week! Then she thought of a loophole. They hadn't said Ora couldn't take a bath! Ora took a bath.,disgust - neutral
On Allison's 25th birthday her family took her to bingo. She had never played before and was nervous. After they showed her how to play she was excited to begin. On the fourth game she got a bingo. Allison plans to pay bingo again in the future.,excitement - nervousness - excitement - neutral
Nya wanted to see the parade downtown. She caught three buses. Then she took the subway. She made it downtown just in time. Nya was excited to be able to watch the parade.,neutral - excitement
Tom bought a new plant. He kept it by his bed. The plant stopped growing. His mother said it needed sunlight. So Tom moved the plant to a window.,neutral - realization - neutral
"Yu Darvish is a pitcher for the Texas Rangers. For the last two seasons he has been injured. According to reports, he is finally healthy and able to play. Ranger fans are hopeful he will be a leader for their pitchers. Ranger fans are looking forward to his return.",neutral - sadness - neutral - optimism - excitement
Avery received a homework assignment due in two weeks. She immediately read through the task. She made a schedule and broke it up into tasks for each day. She completed the tasks on their scheduled day. Avery finished her project early.,excitement - neutral - approval
"Chester decides to go to the mall one afternoon. He does not intend on buying anything, but just wants to walk around. However, he sees a very nice shirt on sale. Chester buys the shirt because the price is so good. Chester was very pleased with the shirt he bought.",neutral - admiration - neutral
Gina realized she needed to get to work on her report. She had wasted the whole day and only had one left to complete it. She sat down and began to work. Her mother wanted her to wash the dishes. Gina wished she hadn't wasted her day.,realization - disappointment - neutral - desire
Tuesdays are laundry days at my apartment. We have been too busy the last couple of Tuesdays. Now we have almost no clean clothes left. I'm dressed foolishly and still smell bad. I will do laundry right now.,neutral - disappointment - disgust - neutral
It was a beautiful summer day outside. Bob decided to go for a walk at the park. Bob walked along the path and admired the scenery. He found a twenty dollar bill on the ground. He was happy.,joy - neutral - admiration - neutral - joy
"Meghan and Scott wanted to see their favorite band play in a concert. Tickets went on sale online and the server was very busy. Meghan and Scott were trying hard to buy tickets. Just when the concert was almost sold out, Meghan found two tickets. They were so relieved.",neutral - relief
"John had just graduated high school, and was about to go to college. His mom helped him pack all his stuff, and he drove away. When he got there, he went to check out his dorm. His new roommate was there, and they hit it off. They walked around campus and got invited to a party.",optimism - neutral - disappointment - joy
"Jackie had been a long distance runner for many Year's. Despite her very full iPod, she became bored with music. One of her running friends recommended an audible book. She loaded a new release to her iPod. She listened to a book while she ran.",approval - neutral
Ari's friends dared her to spend the night in the local haunted house. Ari tentatively agreed. She climbed in through the house's window. Then she snuggled up with her blanket in the corner. She lasted the whole night.,neutral - approval - neutral
Sam drove around with his high beams on. One of his headlights was out and he thought it was safer. He was pulled over last night. The cop gave him a ticket and told him to fix it. Sam was unhappy.,neutral - sadness
Jan was tired of winter and cold weather. She saw a commercial advertising a car that would be great for a trip. She bought the car and planned the trip on a map. She drove all over the state of Florida. By the time she got home it had become warmer due to spring.,neutral - excitement - neutral - realization
Neil had just arrived in Iran. He was enthralled with the cities and countryside. He thought the mountains were so beautiful. The language and people were wonderful too. He was happy to be in Iran.,neutral - fear - admiration - joy
Andrew had been single for many Year's. While he wanted a girlfriend he did not know how to approach anyone. Finally a friend introduced Andrew to a nice young lady. Andrew asked her out on a date. The girl said yes to Andrew.,sadness - neutral - approval
Amy was running late for her flight. She hurried through airport security. She could hear her name over the speaker near her gate. She ran top speed and greeted annoyed stewardess. She boarded her flight just in time.,neutral - excitement
Paul felt brave so he tried to join the Army. The Army said he was too weak to join. Paul was undeterred so he then tried to join the Navy. The Navy refused him because Paul couldn't swim. Paul was very frustrated.,neutral - anger
"The cat chased the mouse across the empty warehouse. Running in fear, the rodent moved as fast as it could. The larger feline stayed close behind. It was terrified. The mouse got away.",neutral - fear - neutral - fear - neutral
"Neil flew into Russia. There, he visited tourist sites and saw friendly locals. He found that Russia was colorful and vibrant. It also had a great and rich history. Neil found the trip stimulating.",neutral - admiration - realization
Mary makes candles. She enjoys this as a hobby. Mary took one to her friend as a gift. Everyone loved the candles and asked to buy one. Mary was very happy.,neutral - joy - neutral - love - joy
It was summer and Gina and her sister were bored. They decided to watch music videos. There was the music video channel or the black entertainment channel. They chose to watch the black entertainment channel. Gina and her sister had a great time together.,neutral - approval - joy
"I was really excited I was going to the beach. I made sure to pack everything up in my car. I drove there and put on my swim trunks. When I came out of the dressing room, it started to rain. My plans were ruined, and I went home.",excitement - neutral - sadness
Arnold was scared of cats. He thinks all of them are creepy. One day he visited his girlfriend's house. His girlfriend has a cat. Arnold dumped his girlfriend.,fear - neutral
Leah is a full time college student who wants a part time job. Leah searches craigslist and finds an entry level position. Leah applies and the next day get a call for an interview. Leah goes to the interview and does really well. Leah gets the job.,neutral - approval - neutral - admiration - neutral
"Bob was driving from Texas to Florida. He refused to stop at hotels for a break. After fifteen hours of driving, he was tired. He began to fall asleep. Bob decided to stay at a nearby hotel for the night.",neutral
I got my concert tickets. I drove to Chicago. I could not believe I was seeing a Beatle. I was 30 rows from the front of the stage. I cheered when the Beatle came under the spotlight.,excitement - approval - surprise - neutral - joy
It was summer. And Jeff's room was very hot. He saw dark blinds advertised to block heat. And he thought it would make a noticeable difference. Joe was pleased when he put up the new blinds.,neutral - admiration - neutral - realization - neutral
"Joey's uncle showed him a marble. He teased Joey and said it was his glass eye. Later, Joey played marbles with friends. One boy said his marble was a cat's eye. Joey knew everybody was just teasing him.",neutral - amusement - neutral - amusement
Jeffries's remote ran out of batteries. It stopped working completely. He needed to replace them. So he went to the store to buy some more. He made sure to buy rechargeable batteries this time.,neutral
I've always wanted to be able to bike thirty miles at one time. Right now I can only bike about twenty miles at once. I got myself a biking trainer who helped me make progress. I worked hard for a few months and ate all the right foods. Now I can bike 30 miles.,desire - neutral - joy - admiration - neutral
"My family has always loved camping, me not so much. The summer I was 19 was the last time I camped. First our car broke down and we were stranded in the heat for hours. I burned my hand cooking dinner, fell in the lake and eaten by bugs. I decided never to go camping again.",love - neutral - sadness - approval
"My professor assigned my class an essay. By the time I left the classroom, I had forgotten about it. A few days later, my classmate messaged me to ask if I had done it. I was so upset because I had totally forgotten! I was worried about my grade.",neutral - realization - neutral - disappointment - fear
Sally believes her boss is trying to fire her. She stays late to make sure her work is correct. Sally is still on edge. She decides to set up a meeting with her boss. Sally hopes her boss will keep her.,neutral
"We decided we would learn to make candy. We checked out a book on the subject and read up. Then, we set to work trying. We realized greatly overestimated how hard it was to make candy. We found we made a mess in the kitchen.",amusement - neutral - realization - disappointment
"Will was very wild in kindergarten, and did not listen to his teacher. His father was very upset with him. He pointed to the school janitor, and told Will that was his future. Will did not want to clean up the school bathrooms. Will started to listen to his teacher.",annoyance - disappointment - neutral - approval
"Emily was very nervous to get her shots at the doctor's office. She hid under the table and cried. When the nurse gave her the shot, Emily reached out and hit her. Both Emily and the nurse were surprised and in pain. Emily was reprimanded by her parents.",nervousness - sadness - neutral - surprise - neutral
My friends and I were playing outside. We wanted to play a new game. We decided to play street hockey since we weren't familiar with it. We went outside and got out gear. We enthusiastically played the game till it got dark.,neutral - desire - neutral - joy
"One day, my computer mouse stopped working. I went to the store to buy a new one. Every mouse I found was too expensive. I went home and decided to try and fix my mouse. I was successful.",neutral - approval - realization - neutral - joy
Samantha was driving to class. She noticed that she forgot her textbook at home. She drove back home in order to get it. She arrived in class 25 minutes late. I was better for her to be late than to be unprepared.,neutral - realization - neutral - approval
It was my first time skiing and I was not doing well. I skied directly in the path of another skier. We collided and both fell to the ground. The other skier told me his name was Jack and it was nice to meet me. I thought Jack was very polite.,disappointment - approval - disappointment - joy - neutral
Gabe needed a desk in his room. But he didn't have a lot of money. He found plywood in his garage. So he made a desk out of it. He polished the wood after he built the desk.,neutral
Jerry wanted to start a new career. He searched the classified ads for job postings. He found a desirable posting in one of the ads. He emailed his resume to the recruiter. Then recruiter set up an interview for Jerry.,desire - neutral
Emile wanted to be a great chef. He took lessons and worked hard learning how to cook. He practiced his cooking and served food for friends. His friends loved his cooking and encouraged him. Emile eventually got a job as a chef.,desire - admiration - neutral - admiration - neutral
"Emily woke up early to get ready for school last Monday. Before she got dressed, she checked to see if school was canceled. It had snowed so much that school was cancelled. Emily was happy and decided to stay inside and read on her day off. She finished her latest book.",approval - neutral - joy - neutral
"Harry secretly hated haunted houses, but couldn't let his friend down. Faking a brave face, the went forth into the darkened house. He managed to make it all way through without screaming out loud. At the very end, they fell through a trick floor into a bunch of goo. Harry wished he wouldn't have went.",neutral - admiration - neutral
Bobby wanted to be a wrestler. He took wrestling in high school. Then he joined a team in college. Soon he was wrestling professionally. He retired early due to injury.,desire - neutral
"Joan decided to treat herself to a fancy sushi dinner. But the food was bad and the waiter was even worse! She asked for the manager but he never bothered to come. Although it was unlike her, Joan got so mad she left without paying. Joan felt bad about the dinner but glad she was assertive.",neutral - disgust - neutral - joy
Jesse had always wanted to get a tattoo. Her parents were very against the idea of tattoos. One her 18th birthday she decided to get one. She got a small tiara tattoo on her shoulder. Jesse's parents were upset with her.,desire - disapproval - excitement - neutral - disappointment
Juliette wanted to be a scientist when she grew up. She decided she must perform an experiment. She emptied a box of baking soda into a pan. Then she poured in vinegar. Juliette built a volcano.,neutral
Jaclyn came over to hang out with Robs girlfriend. Jaclyn and Rob do not get along. Rob tried very nice to keep the peace and be nice. Jaclyn kept saying very snide comments and remarks Rob finally left to hang out with his friends.,neutral - joy - neutral
Sharon and her sister drove to the grocery store to pick up eggs. They were going to have dinner guests and were baking a cake. On the way into the house Sharon tripped and fell. The eggs flew out of her hands and landed on the concrete. Sharon broke all of the eggs.,neutral - realization - neutral - sadness
Ella went out sledding one afternoon. She had fun at first. Then she slipped off the sled. She cut her forehead on a rock in the ground. Ella had to be taken to the doctor.,neutral - joy - neutral - caring
Bobby was a star football player at his school. He would always get recognition for his talent. One day he was in a very important game. His arm was hurt in the process. Bobby took time to recover from the injury.,neutral - admiration - neutral - sadness - neutral
Susan went to the movie theater with her friends. Susan used her cell phone in the theater to check her e-mail. An usher came and asked Susan to leave the theater. Susan had to wait in the lobby while her friends finished the movie. Susan was upset with the whole ordeal.,neutral - disappointment
Margie had a Christmas cactus. It never bloomed. She gave the plant to Desi. Desi took good care of the plant. The cactus flourished under his care.,neutral - realization - neutral - caring - neutral
Gina had been at the park with her friend Pam for hours. Now the sun was setting. She said her goodbyes and headed home. When she arrived it was dark out. Gina went straight to bed.,neutral - fear - neutral
Avery was very excited. Tonight was his very first basketball game. He had practiced and his parents came to watch him. Avery played well with his teammates and even scored some points! Avery's parents were proud.,excitement - admiration - pride
Gary loved to garden. Spring was quickly approaching and he wanted to start planting. He checked the Almanac to see which plants were safe for the garden. Tom decided to plant some orchids. The orchids would be beautiful.,love - neutral - love
Bay was nervous. Her boyfriend had been acting weird all through dinner. Bay thought he was going to dump her. But then he got on one knee. And asked her to marry him.,nervousness - annoyance - neutral
Tommy was having a bad day. His friends tried to cheer him up by taking him out. He grumbled but went along. He drank and danced with his friends all night. Tommy had good friends.,neutral - joy - neutral
Ariel is our 5 month old baby. She had woke up the other morning extremely fussy. We couldn't figure out what was wrong at first. We then seen a fresh tooth popping through her gum line. We had a week of hell as her tooth came in.,neutral - confusion - neutral
"Amelia decided to take a vacation to Mexico. She booked her flight and hotel. When she got to Mexico, she was sure to visit many different things. She loved every moment of it. Amelia decided to vacation to Mexico more often.",neutral - love - neutral
Sometimes my kids wondered if Santa Claus was real. Each year we left cookies and milk for him on Christmas Eve. Each Christmas day we found an empty cup and cookie crumbs. One year we found cookie pieces outside in the snow. We told the kids that Santa must have share with the reindeer.,amusement - neutral
"Amy woke up extra hungry today. Unfortunately, she also woke up very late. She rushed around the house and had no time for breakfast. When she made it to work, she realized her coworker brought breakfast! She was so grateful and promised to pay her coworker back.",neutral - disappointment - neutral - realization - gratitude
The school received a grant to make a computer lab. Their IT department did a lot of research to find the best equipment. They bought the equipment with the grant money. The computer lab was a great success. The government continued to fund computer labs.,approval - admiration - neutral - admiration - neutral
Officer Dunn didn't want to hurt anyone during the protest. He told several people to leave but they didn't. He unleashed his police dog. The dog bit a mother and her baby. Officer Dunn was shocked about what his dog had done.,approval - neutral - surprise
"I drove my motorcycle across the street. I took a path that led to a riding track. I did a few laps. Bored, I drove back home. I cleaned my motorcycle after I got home.",neutral - excitement - neutral - disappointment - approval
"Ryan was called by his friend to skip work one day. He missed his train to work and instead went to the park. Ryan and his friend played with birds at the park all day. At the end of the day, they left the park and saw Ryan's boss. Ryan got fired.",neutral
A man drove for many hours on the highway. He saw a sign for a rest stop two miles away. He put his car in the right lane in anticipation. He took the exit for the rest stop. The man stopped at the rest stop and got out of the car.,neutral - excitement - neutral
"Josiah was a baby who was trying to crawl for the first time. To help him, his mother put out an exciting toy that jingled. As she made the toy rattle, Josiah became very interested. He started groping the ground and inching towards his mom. Josiah crawled to his mother and took the toy.",neutral - approval - neutral
"I wanted a pet for my birthday. I wasn't sure what to get, I already had dogs. I was looking around on facebook and saw a mini pig. I went to pick her up. I drove home with the mini pig in my car.",desire - confusion - neutral - caring - neutral
"Sam wanted to be a singer. So he joined a singing class at his college. The first day of class, everyone was required to sing a song. Sam was very embarrassed the first day. All his classmates were very supportive though.",desire - neutral - excitement - embarrassment - approval
